question,response,time
what are the pending cases in doj,"As a bot working for the DOJ website, I'll do my best to assist you with your query.

What do you want to know about the pending cases in the Department of Justice (DOJ)?

Please specify your query, and I'll do my best to provide you with accurate information based on the scraped text and CSV data provided.

Some examples of questions I can answer:

* How many pending cases are there in the DOJ?
* What are the most common types of cases pending in the DOJ?
* Which states or districts have the most pending cases in the DOJ?
* What is the average age of pending cases in the DOJ?
* What are the top 5 pending cases in the DOJ?

Feel free to ask any questions, and I'll do my best to provide you with the information you need!",2024-11-13 14:16:16.716452
what are the pending cases in supreme court,"I'm happy to help. As a bot working for the Department of Justice (DOJ) website, my primary goal is to provide accurate and helpful information to users. Based on the provided data, I will do my best to answer your questions related to pending cases in the Supreme Court.

**Please ask your question about pending cases in the Supreme Court, and I'll do my best to provide a concise and clear response!**",2024-11-13 14:16:49.474285
what are the pending cases in supreme court ,"I'm happy to help! As a bot working for the Department of Justice (DOJ) website, I'll analyze the user's input to understand their needs and context, and generate responses based on the information retrieved from both scraped text and CSV data.

You've asked me, ""What are the pending cases in the Supreme Court?""

According to the scraped text data from the DOJ website, the Supreme Court of India has a total of 4,51,89,832 pending cases. Here's a breakdown of the pending cases:

* Civil cases: 1,09,27,078
* Criminal cases: 3,42,62,754
* Total pending cases: 4,51,89,832

As for the latest update on pending cases, according to the CSV data:

* As of 01.12.2023, the Supreme Court has a total of 34 judges, and the working strength is 34.
* As of 01.12.2023, the Supreme Court has 0 vacant positions.

Please note that these numbers are subject to change and may not reflect the current status of pending cases in the Supreme Court.

If you have any further questions or would like more information on pending cases in the Supreme Court, please feel free to ask!",2024-11-13 14:17:16.228520
